{
  "catalogVersion": "1.0.0",
  "semanticBindingAlgorithm": "sha256-jcs-acceptance-outcomes-v1",
  "semanticBindingHash": "18f815e7bf1d96cc2fddf2fa5372040c5e34bf62cadaae62907fc7e6584b7dec",
  "supplementaryScenarios": [
    {
      "scenarioRef": "agent-consumption:include counter-evidence",
      "rationale": "Exercises conflict presentation beyond the minimum caveat and evidence-reference criteria."
    },
    {
      "scenarioRef": "agent-consumption:preserve maturity separately from confidence",
      "rationale": "Exercises inferred maturity independently from the unavailable-outcome calibration criterion."
    },
    {
      "scenarioRef": "agent-consumption:promote repeated successful usage",
      "rationale": "Exercises post-validation usage promotion beyond the required identity-removal and revalidation triggers."
    },
    {
      "scenarioRef": "agent-consumption:reconcile retrieval coverage",
      "rationale": "Exercises detailed coverage arithmetic in addition to the criterion-bound truncation behavior."
    },
    {
      "scenarioRef": "agent-consumption:refuse an unsupported question",
      "rationale": "Exercises safe refusal when neither capability nor metric evidence supports a question."
    },
    {
      "scenarioRef": "agent-consumption:retrieve by hybrid relevance",
      "rationale": "Exercises combined ranking mechanics beyond the mandatory authorization and version hard filters."
    },
    {
      "scenarioRef": "identity-and-relationships:treat top-value overlap as supporting evidence",
      "rationale": "Exercises long-tail overlap behavior beyond the required sparse and high-cardinality plans."
    },
    {
      "scenarioRef": "operations-and-governance:append a tamper-evident audit event",
      "rationale": "Exercises audit payload contents in addition to canonical digest and predecessor invariants."
    },
    {
      "scenarioRef": "operations-and-governance:create a new source and manifest version after structural mutation",
      "rationale": "Exercises the combined version transition beyond independently bound source and projection criteria."
    },
    {
      "scenarioRef": "operations-and-governance:reject feedback authority spoofing",
      "rationale": "Exercises a concrete caller-authority spoof attempt beyond the authenticated lifecycle criterion."
    },
    {
      "scenarioRef": "semantic-and-business-model:generated semantics are unavailable",
      "rationale": "Exercises provider unavailability beyond malformed-output corrective retry behavior."
    },
    {
      "scenarioRef": "semantic-and-business-model:reconcile domains holistically",
      "rationale": "Exercises cross-asset domain reconciliation beyond the required typed business concepts."
    },
    {
      "scenarioRef": "source-onboarding:register an authorized source",
      "rationale": "Exercises the successful registration path alongside the required unsupported and secret-failure paths."
    },
    {
      "scenarioRef": "source-onboarding:reject an unauthorized source",
      "rationale": "Exercises entitlement refusal before enumeration as a defense-in-depth onboarding case."
    },
    {
      "scenarioRef": "structural-and-statistical-profiling:detect a type variant in nested records",
      "rationale": "Exercises mixed physical variants beyond the required approximate-count labeling behavior."
    },
    {
      "scenarioRef": "structural-and-statistical-profiling:distinguish requested sample size from actual work",
      "rationale": "Exercises partial-work accounting beyond zero-work refusal and deterministic selection."
    },
    {
      "scenarioRef": "structural-and-statistical-profiling:preserve a rare value stratum",
      "rationale": "Exercises stratification quality beyond deterministic repeatability requirements."
    },
    {
      "scenarioRef": "structural-and-statistical-profiling:profile a small asset exactly",
      "rationale": "Exercises the exact-scan branch alongside approximate and empty-population criteria."
    },
    {
      "scenarioRef": "universal-source-types:handle an expired stream offset",
      "rationale": "Exercises stream-specific resume failure in addition to the generic expired-boundary criterion."
    },
    {
      "scenarioRef": "universal-source-types:isolate an unauthorized graph neighbor",
      "rationale": "Exercises graph-native authorization filtering beyond common served-projection scope checks."
    },
    {
      "scenarioRef": "universal-source-types:preserve partial api pagination",
      "rationale": "Exercises connector pagination coverage beyond common run and retrieval accounting."
    },
    {
      "scenarioRef": "universal-source-types:preserve unavailable document parsing",
      "rationale": "Exercises encrypted-document partial profiling beyond parser resource-limit criteria."
    },
    {
      "scenarioRef": "universal-source-types:profile a document corpus",
      "rationale": "Exercises document-native evidence while the acceptance criterion governs common source-kind declarations."
    },
    {
      "scenarioRef": "universal-source-types:profile a graph",
      "rationale": "Exercises graph-native evidence while the acceptance criterion governs the common extension vector."
    },
    {
      "scenarioRef": "universal-source-types:profile a polymorphic nested field",
      "rationale": "Exercises nested shape prevalence beyond the criterion-bound source-kind registry behavior."
    },
    {
      "scenarioRef": "universal-source-types:profile a tabular file collection",
      "rationale": "Exercises tabular-file partitions and schema variants as a reusable source-specific example."
    },
    {
      "scenarioRef": "universal-source-types:profile an api contract",
      "rationale": "Exercises safe API contract sampling beyond the criterion-bound unsupported-semantics behavior."
    },
    {
      "scenarioRef": "universal-source-types:profile an api without a contract",
      "rationale": "Exercises inferred API structure when authoritative contract metadata is unavailable."
    },
    {
      "scenarioRef": "universal-source-types:profile an event stream",
      "rationale": "Exercises stream-native temporal and correlation evidence beyond the common extension criterion."
    },
    {
      "scenarioRef": "universal-source-types:profile multimodal assets",
      "rationale": "Exercises cross-modal provenance beyond the common extension and parser-boundary criteria."
    },
    {
      "scenarioRef": "universal-source-types:validate a document citation",
      "rationale": "Exercises citation transport-versus-rejection semantics beyond common relationship validation."
    }
  ],
  "requirements": [
    {
      "id": "FR-001",
      "title": "Connector capability negotiation",
      "priority": "P0",
      "statement": "The system shall register each source through a connector-neutral descriptor and shall negotiate supported read capabilities before planning a run.",
      "acceptance": [
        {
          "id": "AC-01",
          "text": "Unsupported stages are marked not-applicable or unavailable, never silently successful."
        },
        {
          "id": "AC-02",
          "text": "No secret value is stored in the source descriptor."
        }
      ],
      "bdd": [
        {
          "acceptanceId": "AC-01",
          "scenarioRef": "source-onboarding:negotiate an unsupported capability"
        },
        {
          "acceptanceId": "AC-02",
          "scenarioRef": "source-onboarding:reject embedded credentials"
        }
      ]
    },
    {
      "id": "FR-002",
      "title": "Read-only enforcement",
      "priority": "P0",
      "statement": "The profiling plane shall permit only enumerating, reading, sampling, aggregating, and metadata operations unless a separate write capability is explicitly granted.",
      "acceptance": [
        {
          "id": "AC-01",
          "text": "Mutating source commands are rejected before connector invocation."
        },
        {
          "id": "AC-02",
          "text": "Source content cannot alter the operation allowlist."
        }
      ],
      "bdd": [
        {
          "acceptanceId": "AC-01",
          "scenarioRef": "operations-and-governance:reject a mutating probe"
        },
        {
          "acceptanceId": "AC-02",
          "scenarioRef": "operations-and-governance:treat source text as untrusted data"
        }
      ]
    },
    {
      "id": "FR-003",
      "title": "Durable run state machine",
      "priority": "P0",
      "statement": "Each profiling run shall persist immutable identity, mode, trigger, policy hash, source version, stage states, checkpoints, coverage, budget use, and terminal outcome.",
      "acceptance": [
        {
          "id": "AC-01",
          "text": "A resume resolves a purpose-signed immutable predecessor checkpoint, proves every prerequisite stage receipt, preserves compatible source/scope/connector/policy/method/taxonomy/revocation coordinates, requires an unexpired source boundary, and acquires a fresh lease/fencing token."
        },
        {
          "id": "AC-02",
          "text": "A completed or failed run is terminal; a reprofile creates a new run."
        },
        {
          "id": "AC-03",
          "text": "A durable pending run exists before lease acquisition with no fencing token; a running run has an unexpired matching lease/token; and terminal state releases the lease while preserving its fencing token."
        }
      ],
      "bdd": [
        {
          "acceptanceId": "AC-01",
          "scenarioRef": "source-onboarding:resume an interrupted run"
        },
        {
          "acceptanceId": "AC-02",